ORF,GENE,s coeff nominal,s coeff nacl,DIFF,Name,Function
YOR168W,GLN4,-0.005055998,0.011919449,0.016975446,GLutamiNe metabolism,"Glutamine tRNA synthetase, monomeric class I tRNA synthetase that catalyzes the specific glutaminylation of tRNA(Glu); N-terminal domain proposed to be involved in enzyme-tRNA interactions"
YOR210W,RPB10,-0.005043689,-0.006730174,0.001686485,RNA Polymerase B,"RNA polymerase subunit ABC10-beta, common to RNA polymerases I, II, and III"
YNL313C,EMW1,-0.005037272,-0.009810702,0.004773429,Essential for Maintenance of the cell Wall,Essential conserved protein with a role in maintaining cell wall integrity; contains six TPR (tetratricopeptide repeat) domains clustered in the C-terminal region; conditional mutant is suppressed by overexpression of GFA1
YKL196C,YKT6,-0.004880873,-0.001534114,0.003346759,0,"Vesicle membrane protein (v-SNARE) with acyltransferase activity; involved in trafficking to and within the Golgi, endocytic trafficking to the vacuole, and vacuolar fusion; membrane localization due to prenylation at the carboxy-terminus"
YHR058C,MED6,-0.004878036,0.006912617,0.011790653,MEDiator complex,Subunit of the RNA polymerase II mediator complex; associates with core polymerase subunits to form the RNA polymerase II holoenzyme; essential for transcriptional regulation
YMR203W,TOM40,-0.004857043,-0.002920283,0.00193676,Translocase of the Outer Mitochondrial membrane,Component of the TOM (translocase of outer membrane) complex responsible for recognition and initial import steps for all mitochondrially directed proteins; constitutes the core element of the protein conducting pore
YDL165W,CDC36,-0.004823683,0.00104381,0.005867493,Cell Division Cycle,"Component of the CCR4-NOT complex, which has multiple roles in regulating mRNA levels including regulation of transcription and destabilizing mRNAs by deadenylation; basal transcription factor"
YPR165W,RHO1,-0.004821578,-0.015245321,0.010423744,Ras HOmolog,"GTP-binding protein of the rho subfamily of Ras-like proteins, involved in establishment of cell polarity; regulates protein kinase C (Pkc1p) and the cell wall synthesizing enzyme 1,3-beta-glucan synthase (Fks1p and Gsc2p)"
YER048W-A,ISD11,-0.004778737,0.01287212,0.017650856,"Iron-Sulfur protein biogenesis, Desulfurase-interacting protein",Cysteine desulfurase (Nfs1p) activator; essential for the formation of the persulfide intermediate at the desulfurase active site during pyridoxal phosphate-dependent desulfuration of cysteine; required for mitochondrial iron-sulfur cluster biosynthesis
YKR025W,RPC37,-0.004739845,-0.005930082,0.001190237,RNA Polymerase C,RNA polymerase III subunit C37
YPR182W,SMX3,-0.004724616,-0.000744561,0.003980056,0,"Core Sm protein Sm F; part of heteroheptameric complex (with Smb1p, Smd1p, Smd2p, Smd3p, Sme1p, and Smx2p) that is part of the spliceosomal U1, U2, U4, and U5 snRNPs; homolog of human Sm F"
YBR153W,RIB7,-0.004692951,0.000250085,0.004943036,RIBoflavin biosynthesis,Diaminohydroxyphoshoribosylaminopyrimidine deaminase; catalyzes the second step of the riboflavin biosynthesis pathway
YFR037C,RSC8,-0.004659617,-0.000531053,0.004128564,Remodel the Structure of Chromatin,"Component of the RSC chromatin remodeling complex; essential for viability and mitotic growth; homolog of SWI/SNF subunit Swi3p, but unlike Swi3p, does not activate transcription of reporters"
YGR147C,NAT2,-0.004657544,-0.003123872,0.001533672,N-terminal AcetylTransferase,Protein with an apparent role in acetylation of N-terminal methionine residues
YDR062W,LCB2,-0.004605625,-0.001394829,0.003210796,Long-Chain Base,"Component of serine palmitoyltransferase, responsible along with Lcb1p for the first committed step in sphingolipid synthesis, which is the condensation of serine with palmitoyl-CoA to form 3-ketosphinganine"
YMR218C,TRS130,-0.004529186,-0.003065116,0.001464069,TRapp Subunit,One of 10 subunits of the transport protein particle (TRAPP) complex of the cis-Golgi which mediates vesicle docking and fusion; involved in ER to Golgi membrane traffic; mutation activates transcription of OCH1
YKR037C,SPC34,-0.004510052,0.000837338,0.005347389,Spindle Pole Component,"Essential subunit of the Dam1 complex (aka DASH complex), couples kinetochores to the force produced by MT depolymerization thereby aiding in chromosome segregation; also localized to nuclear side of spindle pole body"
YKR083C,DAD2,-0.004497766,-0.003787597,0.000710169,Duo1 And Dam1 interacting,"Essential subunit of the Dam1 complex (aka DASH complex), couples kinetochores to the force produced by MT depolymerization thereby aiding in chromosome segregation; is transferred to the kinetochore prior to mitosis"
YNL118C,DCP2,-0.004484496,-0.002778177,0.001706319,mRNA DeCaPping,"Catalytic subunit of the Dcp1p-Dcp2p decapping enzyme complex, which removes the 5' cap structure from mRNAs prior to their degradation; member of the Nudix hydrolase family"
YDR180W,SCC2,-0.004479397,-0.009186257,0.00470686,Sister Chromatid Cohesion,"Subunit of cohesin loading factor (Scc2p-Scc4p), a complex required for loading of cohesin complexes onto chromosomes; involved in establishing sister chromatid cohesion during DSB repair via histone H2AX; evolutionarily-conserved adherin"
YCL054W,SPB1,-0.004455733,-0.008747698,0.004291965,Suppressor of PaB1 mutant,"AdoMet-dependent methyltransferase involved in rRNA processing and 60S ribosomal subunit maturation; methylates G2922 in the tRNA docking site of the large subunit rRNA and in the absence of snR52, U2921; suppressor of PAB1 mutants"
YDL098C,SNU23,-0.004420473,-0.000779874,0.003640599,Small NUclear ribonucleoprotein associated,Component of U4/U6.U5 snRNP involved in mRNA splicing via spliceosome
YOR004W,UTP23,-0.004367597,-0.008676937,0.00430934,U Three-associated Protein,"Component of the small subunit processome, involved in 40S ribosomal subunit biogenesis; interacts with snR30 and is required for dissociation of snR30 from large pre-ribosomal particles; has homology to PINc domain protein Fcf1p, although the PINc domain of Utp23p is not required for function; essential protein"
YOR341W,RPA190,-0.004332394,-0.007718622,0.003386228,RNA Polymerase A,RNA polymerase I largest subunit A190
YML046W,PRP39,-0.004329228,-0.006195661,0.001866432,Pre-mRNA Processing,"U1 snRNP protein involved in splicing, contains multiple tetriatricopeptide repeats"
YBR252W,DUT1,-0.004272282,-0.00605354,0.001781257,DUTp pyrophosphatase,"deoxyuridine triphosphate diphosphatase (dUTPase); catalyzes hydrolysis of dUTP to dUMP and PPi, thereby preventing incorporation of uracil into DNA during replication; critical for the maintenance of genetic stability; also has diphosphatase activity on deoxyinosine triphosphate"
YOL133W,HRT1,-0.004265761,-0.005009074,0.000743313,High level expression Reduces Ty3 transposition,"RING finger containing subunit of Skp1-Cullin-F-box ubiquitin protein ligases (SCF); required for Gic2p, Far1p, Sic1p and Cln2p degradation; may tether Cdc34p (a ubiquitin conjugating enzyme or E2) and Cdc53p (a cullin) subunits of SCF"
YHR186C,KOG1,-0.004232809,-0.001471852,0.002760957,Kontroller Of Growth,"Subunit of TORC1, a rapamycin-sensitive complex involved in growth control that contains Tor1p or Tor2p, Lst8p and Tco89p; contains four HEAT repeats and seven WD-40 repeats; may act as a scaffold protein to couple TOR and its effectors"
YOR077W,RTS2,-0.004222911,-0.005170479,0.000947569,0,"Basic zinc-finger protein, similar to human and mouse Kin17 proteins which are chromatin-associated proteins involved in UV response and DNA replication"
YMR043W,MCM1,-0.004190867,-0.031100339,0.026909471,MiniChromosome Maintenance,Transcription factor involved in cell-type-specific transcription and pheromone response; plays a central role in the formation of both repressor and activator complexes
YNL007C,SIS1,-0.004164343,0.001103197,0.00526754,SIt4 Suppressor,Type II HSP40 co-chaperone that interacts with the HSP70 protein Ssa1p; not functionally redundant with Ydj1p due to due to substrate specificity; shares similarity with bacterial DnaJ proteins
YOR095C,RKI1,-0.004153101,0.002701437,0.006854538,Ribose-5-phosphate Ketol-Isomerase,"Ribose-5-phosphate ketol-isomerase, catalyzes the interconversion of ribose 5-phosphate and ribulose 5-phosphate in the pentose phosphate pathway; participates in pyridoxine biosynthesis"
YDR045C,RPC11,-0.004114587,0.00072742,0.004842007,RNA Polymerase C,RNA polymerase III subunit C11; mediates pol III RNA cleavage activity and is important for termination of transcription; homologous to TFIIS
YGR172C,YIP1,-0.004067251,-0.000852949,0.003214301,0,"Integral membrane protein required for the biogenesis of ER-derived COPII transport vesicles; interacts with Yif1p and Yos1p; localizes to the Golgi, the ER, and COPII vesicles; homolog of human YIPF4"
YDL003W,MCD1,-0.004044698,-0.001774618,0.00227008,Mitotic Chromosome Determinant,Essential subunit of the cohesin complex required for sister chromatid cohesion in mitosis and meiosis; apoptosis induces cleavage and translocation of a C-terminal fragment to mitochondria; expression peaks in S phase
YNL182C,IPI3,-0.004035663,0.020723397,0.024759061,Involved in Processing ITS2,"Essential component of the Rix1 complex (Rix1p, Ipi1p, Ipi3p) that is required for processing of ITS2 sequences from 35S pre-rRNA; highly conserved and contains WD40 motifs; Rix1 complex associates with Mdn1p in pre-60S ribosomal particles"
YFR042W,KEG1,-0.003946574,0.00139616,0.005342734,Kre6-binding ER protein responsible for Glucan synthesis,"Integral membrane protein of the ER; physically interacts with Kre6p; has a role in the synthesis of beta-1,6-glucan in the cell wall; required for cell viability"
YGR267C,FOL2,-0.003931605,-0.01208152,0.008149915,FOLic acid synthesis,"GTP-cyclohydrolase I, catalyzes the first step in the folic acid biosynthetic pathway"
YML015C,TAF11,-0.003921832,0.004697381,0.008619213,TATA binding protein-Associated Factor,"TFIID subunit (40 kDa), involved in RNA polymerase II transcription initiation, similar to histone H3 with atypical histone fold motif of Spt3-like transcription factors"
YEL055C,POL5,-0.003919813,-0.020506504,0.016586691,POLymerase,"DNA Polymerase phi; has sequence similarity to the human MybBP1A and weak sequence similarity to B-type DNA polymerases, not required for chromosomal DNA replication; required for the synthesis of rRNA"
YMR112C,MED11,-0.003833992,-0.01340586,0.009571868,MEDiator complex,Subunit of the RNA polymerase II mediator complex; associates with core polymerase subunits to form the RNA polymerase II holoenzyme; essential protein
YDR064W,RPS13,-0.00380721,-0.002222357,0.001584854,Ribosomal Protein of the Small subunit,Protein component of the small (40S) ribosomal subunit; has similarity to E. coli S15 and rat S13 ribosomal proteins
YOR159C,SME1,-0.003800928,0.00276508,0.006566008,0,"Core Sm protein Sm E; part of heteroheptameric complex (with Smb1p, Smd1p, Smd2p, Smd3p, Smx3p, and Smx2p) that is part of the spliceosomal U1, U2, U4, and U5 snRNPs; homolog of human Sm E"
YKL099C,UTP11,-0.00378334,-0.001282308,0.002501032,U Three Protein,Subunit of U3-containing Small Subunit (SSU) processome complex involved in production of 18S rRNA and assembly of small ribosomal subunit
YJL085W,EXO70,-0.003774378,-0.003543992,0.000230386,EXOcyst,"Subunit of the exocyst complex (Sec3p, Sec5p, Sec6p, Sec8p, Sec10p, Sec15p, Exo70p, and Exo84p), which directs secretory vesicles to active sites of exocytosis; acts with Sec3p in membrane targeting of the exocyst via PI(4,5)P2 binding"
YPR085C,ASA1,-0.00373716,-0.004301933,0.000564773,AStra Associated protein,"Subunit of the ASTRA complex, involved in chromatin remodeling; telomere length regulator involved in the stability or biogenesis of PIKKs such as TORC1"
YPL218W,SAR1,-0.003724721,-0.002757981,0.00096674,"Secretion-Associated, Ras-related","GTPase, GTP-binding protein of the ARF family, component of COPII coat of vesicles; required for transport vesicle formation during ER to Golgi protein transport"
YGR185C,TYS1,-0.003724175,0.000684673,0.004408849,TYrosyl-tRNA Synthetase,"Cytoplasmic tyrosyl-tRNA synthetase, required for cytoplasmic protein synthesis; interacts with positions 34 and 35 of the tRNATyr anticodon; mutations in human ortholog YARS are associated with Charcot-Marie-Tooth (CMT) neuropathies"
YMR281W,GPI12,-0.003710676,-0.003864132,0.000153455,GlycosylPhosphatidylInositol anchor biosynthesis,"ER membrane protein involved in the second step of glycosylphosphatidylinositol (GPI) anchor assembly, the de-N-acetylation of the N-acetylglucosaminylphosphatidylinositol intermediate; functional homolog of human PIG-Lp"
YER126C,NSA2,-0.003706232,-0.006148222,0.00244199,Nop Seven Associated,"Protein constituent of 66S pre-ribosomal particles, contributes to processing of the 27S pre-rRNA"
YGL061C,DUO1,-0.003631672,0.00147933,0.005111002,Death Upon Overproduction,"Essential subunit of the Dam1 complex (aka DASH complex), couples kinetochores to the force produced by MT depolymerization thereby aiding in chromosome segregation; is transferred to the kinetochore prior to mitosis"
YIL062C,ARC15,-0.003625498,-0.000594684,0.003030813,ARp2/3 Complex subunit,"Subunit of the ARP2/3 complex, which is required for the motility and integrity of cortical actin patches; has mRNA binding activity"
YHR036W,BRL1,-0.003585228,0.013838012,0.017423241,BRr6 Like protein,"Essential nuclear envelope integral membrane protein identified as a suppressor of a conditional mutation in the major karyopherin, CRM1; homologous to and interacts with Brr6p, a nuclear envelope protein involved in nuclear export"
YNL290W,RFC3,-0.003567432,-0.005888547,0.002321116,Replication Factor C,"Subunit of heteropentameric Replication factor C (RF-C), which is a DNA binding protein and ATPase that acts as a clamp loader of the proliferating cell nuclear antigen (PCNA) processivity factor for DNA polymerases delta and epsilon"
YLR103C,CDC45,-0.003548549,-0.002173233,0.001375316,Cell Division Cycle,"DNA replication initiation factor; recruited to MCM pre-RC complexes at replication origins; promotes release of MCM from Mcm10p, recruits elongation machinery; mutants in human homolog may cause velocardiofacial and DiGeorge syndromes"
YAL001C,TFC3,-0.003547592,0.001495351,0.005042943,Transcription Factor class C,Largest of six subunits of the RNA polymerase III transcription initiation factor complex (TFIIIC); part of the TauB domain of TFIIIC that binds DNA at the BoxB promoter sites of tRNA and similar genes; cooperates with Tfc6p in DNA binding
YLR141W,RRN5,-0.003544558,0.002195896,0.005740454,Regulation of RNA polymerase I,"Protein involved in transcription of rDNA by RNA polymerase I; transcription factor, member of UAF (upstream activation factor) family along with Rrn9p and Rrn10p"
YMR227C,TAF7,-0.003539235,-0.008212394,0.004673158,TATA binding protein-Associated Factor,"TFIID subunit (67 kDa), involved in RNA polymerase II transcription initiation"
YJL061W,NUP82,-0.003423238,-0.009754377,0.006331139,NUclear Pore,"Linker nucleoporin component of the nuclear pore complex (NPC); also part of the NPC cytoplasmic filaments; contributes to nucleocytoplasmic transport and NPC biogenesis; forms stable associations with three FG-nucleoporins (Nsp1p, Nup159p, and Nup116p)"
YGL040C,HEM2,-0.003407408,-0.00298036,0.000427049,HEMe biosynthesis,"Aminolevulinate dehydratase, a homo-octameric enzyme, catalyzes the conversion of 5-aminolevulinate to porphobilinogen, the second step in heme biosynthesis; enzymatic activity is zinc-dependent; localizes to the cytoplasm and nucleus"
YLR145W,RMP1,-0.003400126,0.001758378,0.005158504,RNase MRP Protein,"Subunit of RNase MRP, which processes pre-rRNA and has a role in cell cycle-regulated degradation of daughter cell-specific mRNAs; unlike most subunits, not shared between RNase MRP and nuclear RNase P"
YDR212W,TCP1,-0.003399185,0.000629319,0.004028504,Tailless Complex Polypeptide,"Alpha subunit of chaperonin-containing T-complex, which mediates protein folding in the cytosol; involved in actin cytoskeleton maintenance; overexpression in neurons suppresses formation of pathogenic conformations of huntingtin protein"
YLR045C,STU2,-0.00338037,-0.006124163,0.002743793,Suppressor of tub2,Microtubule-associated protein (MAP) of the XMAP215/Dis1 family; regulates microtubule dynamics during spindle orientation and metaphase chromosome alignment; interacts with spindle pole body component Spc72p
YGL047W,ALG13,-0.003378182,0.001426055,0.004804237,Asparagine-Linked Glycosylation,"Catalytic component of UDP-GlcNAc transferase, required for the second step of dolichyl-linked oligosaccharide synthesis; anchored to the ER membrane via interaction with Alg14p; similar to bacterial and human glycosyltransferases"
YDL145C,COP1,-0.003332771,-0.009590997,0.006258226,COat Protein,"Alpha subunit of COPI vesicle coatomer complex, which surrounds transport vesicles in the early secretory pathway"
YDR182W,CDC1,-0.003301602,8.78E-05,0.003389425,Cell Division Cycle,Putative lipid phosphatase of the endoplasmic reticulum; shows Mn2+ dependence and may affect Ca2+ signaling; mutants display actin and general growth defects and pleiotropic defects in cell cycle progression and organelle distribution
YGR246C,BRF1,-0.003285199,-0.004315673,0.001030474,B-Related Factor,"TFIIIB B-related factor, one of three subunits of RNA polymerase III transcription initiation factor TFIIIB, binds TFIIIC and TBP and recruits RNA pol III to promoters, amino-terminal half is homologous to TFIIB"
YJL074C,SMC3,-0.003250001,-0.00306365,0.000186351,Structural Maintenance of Chromosomes,"Subunit of the multiprotein cohesin complex required for sister chromatid cohesion in mitotic cells; also required, with Rec8p, for cohesion and recombination during meiosis; phylogenetically conserved SMC chromosomal ATPase family member"
YNL261W,ORC5,-0.00321764,-0.002474556,0.000743085,Origin Recognition Complex,"Subunit of the origin recognition complex, which directs DNA replication by binding to replication origins and is also involved in transcriptional silencing"
YGR009C,SEC9,-0.00321598,-0.00541233,0.002196351,SECretory,t-SNARE protein important for fusion of secretory vesicles with the plasma membrane; similar to but not functionally redundant with Spo20p; SNAP-25 homolog
YIL150C,MCM10,-0.003172346,-0.002279959,0.000892388,MiniChromosome Maintenance,Essential chromatin-associated protein involved in the initiation of DNA replication; required for the association of the MCM2-7 complex with replication origins
YKL125W,RRN3,-0.003163972,0.003748925,0.006912897,Regulation of RNA polymerase I,Protein required for transcription of rDNA by RNA polymerase I; transcription factor independent of DNA template; involved in recruitment of RNA polymerase I to rDNA; structure reveals unique HEAT repeat fold and a surface serine patch; phosphorylation of serine patch impairs cell growth and reduces RNA polymerase I binding in vitro and RNA polymerase I recruitment to the rDNA gene in vivo
YLR116W,MSL5,-0.003149789,0.001669127,0.004818915,Mud Synthetic-Lethal,"Component of the commitment complex, which defines the first step in the splicing pathway; essential protein that interacts with Mud2p and Prp40p, forming a bridge between the intron ends; also involved in nuclear retention of pre-mRNA"
YKL108W,SLD2,-0.003135342,0.000403292,0.003538634,Synthetically Lethal with Dpb11-1,"Single-stranded DNA origin-binding and annealing protein; required for the initiation of DNA replication; phosphorylated in S phase by cyclin-dependent kinases (Cdks), promoting origin binding, DNA replication and Dpb11p complex formation; component of the preloading complex; unphosphorylated or CDK-phosphorylated Sld2p binds to the MCM2-7 complex;required for the S phase checkpoint"
YDR243C,PRP28,-0.003129782,-0.00137113,0.001758652,Pre-mRNA Processing,"RNA helicase in the DEAD-box family, involved in RNA isomerization at the 5' splice site"
YDL105W,NSE4,-0.003127478,-0.003245466,0.000117988,Non-SMC Element,Component of the SMC5-SMC6 complex; this complex plays a key role in the removal of X-shaped DNA structures that arise between sister chromatids during DNA replication and repair
YPR133C,SPN1,-0.003127241,0.008658658,0.011785899,Suppresses Postrecruitment functions gene Number 1,"Protein involved in RNA polymerase II transcription; interacts genetically or physically with RNAP II, TBP, TFIIS, and chromatin remodelling factors; central domain highly conserved throughout eukaryotes; mutations confer an Spt- phenotype"
YNL222W,SSU72,-0.003035476,-0.00107741,0.001958067,"Suppressor of SUa7, gene 2",Transcription/RNA-processing factor that associates with TFIIB and cleavage/polyadenylation factor Pta1p; exhibits phosphatase activity on serine-5 of the RNA polymerase II C-terminal domain; affects start site selection in vivo
YOR174W,MED4,-0.003010043,-0.000451561,0.002558483,MEDiator complex,Subunit of the RNA polymerase II mediator complex; associates with core polymerase subunits to form the RNA polymerase II holoenzyme; essential for transcriptional regulation
YMR208W,ERG12,-0.003009587,-0.003620972,0.000611385,ERGosterol biosynthesis,"Mevalonate kinase, acts in the biosynthesis of isoprenoids and sterols, including ergosterol, from mevalonate"
YDR196C,CAB5,-0.002999437,-0.008360495,0.005361057,0,Probable dephospho-CoA kinase (DPCK) that catalyzes the last step in coenzyme A biosynthesis; null mutant lethality is complemented by E. coli coaE (encoding DPCK); detected in purified mitochondria in high-throughput studies
YDR489W,SLD5,-0.00299295,-0.006627844,0.003634894,Synthetic Lethality with Dpb11-1,"Subunit of the GINS complex (Sld5p, Psf1p, Psf2p, Psf3p), which is localized to DNA replication origins and implicated in assembly of the DNA replication machinery"
YNL162W,RPL42A,-0.002984214,-0.001942386,0.001041828,Ribosomal Protein of the Large subunit,"Protein component of the large (60S) ribosomal subunit, identical to Rpl42Bp and has similarity to rat L44 ribosomal protein"
YDR013W,PSF1,-0.002978825,0.001055621,0.004034446,Partner of Sld Five,"Subunit of the GINS complex (Sld5p, Psf1p, Psf2p, Psf3p), which is localized to DNA replication origins and implicated in assembly of the DNA replication machinery"
YDR232W,HEM1,-0.002907923,-0.001047951,0.001859972,HEMe biosynthesis,"5-aminolevulinate synthase, catalyzes the first step in the heme biosynthetic pathway; an N-terminal signal sequence is required for localization to the mitochondrial matrix; expression is regulated by Hap2p-Hap3p"
YJR022W,LSM8,-0.002862405,0.010268096,0.013130501,Like SM,"Lsm (Like Sm) protein; forms heteroheptameric complex (with Lsm2p, Lsm3p, Lsm4p, Lsm5p, Lsm6p, and Lsm7p) that is part of spliceosomal U6 snRNP and is also implicated in processing of pre-tRNA, pre-snoRNA, and pre-rRNA"
YGR030C,POP6,-0.002842346,0.00013545,0.002977796,Processing Of Precursor RNAs,"Subunit of both RNase MRP and nuclear RNase P; RNase MRP cleaves pre-rRNA, while nuclear RNase P cleaves tRNA precursors to generate mature 5' ends and facilitates turnover of nuclear RNAs"
YGR145W,ENP2,-0.002840788,-0.004792259,0.001951471,Essential Nuclear Protein,"Essential nucleolar protein, required for biogenesis of the small ribosomal subunit; contains WD repeats, interacts with Mpp10p and Bfr2p, and has homology to Spb1p"
YIR011C,STS1,-0.002756603,0.003147173,0.005903776,Sec Twenty-three Suppressor 1,Protein required for localizing proteasomes to the nucleus; interacts with the karyopherin Srp1p; involved in ubiquitin-mediated protein degradation
YGL171W,ROK1,-0.002742724,-0.002371938,0.000370787,Rescuer Of Kem1,"RNA-dependent ATPase; involved in pre-rRNA processing at sites A0, A1, and A2, and in control of cell cycle progression; contains two upstream open reading frames (uORFs) in 5' untranslated region which regulate translation"
YJL001W,PRE3,-0.002734189,0.000946089,0.003680278,PRoteinase yscE,"Beta 1 subunit of the 20S proteasome, responsible for cleavage after acidic residues in peptides"
YHR196W,UTP9,-0.002720189,0.004035852,0.006756041,U Three Protein,"Nucleolar protein, component of the small subunit (SSU) processome containing the U3 snoRNA that is involved in processing of pre-18S rRNA"
YKL078W,DHR2,-0.002715233,-0.005965707,0.003250474,DEAH-box RNA helicase,"Predominantly nucleolar DEAH-box ATP-dependent RNA helicase, required for 18S rRNA synthesis"
YMR200W,ROT1,-0.002610805,-0.001432403,0.001178401,Reversal Of Tor2 lethality,"Molecular chaperone involved in protein folding in the ER; mutation causes defects in cell wall synthesis and in lysis of autophagic bodies, suppresses tor2 mutations, and is synthetically lethal with kar2-1 and with rot2 mutations; involved in N-linked glycosylation and O-mannosylation"
YLR409C,UTP21,-0.002606596,-0.002277095,0.000329501,U Three Protein,Subunit of U3-containing 90S preribosome and Small Subunit (SSU) processome complexes involved in production of 18S rRNA and assembly of small ribosomal subunit; synthetic defect with STI1 Hsp90 cochaperone; human homolog linked to glaucoma
YOR319W,HSH49,-0.002569299,0.001662056,0.004231354,Human Sap Homolog,U2-snRNP associated splicing factor with similarity to the mammalian splicing factor SAP49; proposed to function as a U2-snRNP assembly factor along with Hsh155p and binding partner Cus1p; contains two RNA recognition motifs (RRM)
YKL028W,TFA1,-0.002568813,0.008197066,0.010765879,"Transcription Factor a, subunit 1","TFIIE large subunit, involved in recruitment of RNA polymerase II to the promoter, activation of TFIIH, and promoter opening"
