ORF,GENE,s coeff nominal,s coeff nacl,DIFF,Name,Function
YKL022C,CDC16,-0.00104138,-0.001495035,0.000453655,Cell Division Cycle,"Subunit of the anaphase-promoting complex/cyclosome (APC/C), which is a ubiquitin-protein ligase required for degradation of anaphase inhibitors, including mitotic cyclins, during the metaphase/anaphase transition; required for sporulation"
YJR123W,RPS5,-0.001034543,0.003888086,0.004922629,Ribosomal Protein of the Small subunit,"Protein component of the small (40S) ribosomal subunit, the least basic of the non-acidic ribosomal proteins; phosphorylated in vivo; essential for viability; has similarity to E. coli S7 and rat S5 ribosomal proteins"
YNR026C,SEC12,-0.001025294,0.00087921,0.001904504,SECretory,"Guanine nucleotide exchange factor (GEF), activates Sar1p by catalyzing the exchange of GDP for GTP; required for the initiation of COPII vesicle formation in ER to Golgi transport; glycosylated integral membrane protein of the ER"
YPR105C,COG4,-0.001022879,0.001323575,0.002346454,Conserved Oligomeric Golgi complex,"Essential component of the conserved oligomeric Golgi complex (Cog1p through Cog8p), a cytosolic tethering complex that functions in protein trafficking to mediate fusion of transport vesicles to Golgi compartments"
YGL008C,PMA1,-0.001004574,-0.006195815,0.005191241,Plasma Membrane ATPase,"Plasma membrane H+-ATPase, pumps protons out of the cell; major regulator of cytoplasmic pH and plasma membrane potential; P2-type ATPase; Hsp30p plays a role in Pma1p regulation; interactions with Std1p appear to propagate [GAR+]"
YGR113W,DAM1,-0.000999139,0.000922017,0.001921157,Duo1 And Mps1 interacting,"Essential subunit of the Dam1 complex (aka DASH complex), couples kinetochores to the force produced by MT depolymerization thereby aiding in chromosome segregation; Ipl1p target for regulating kinetochore-MT attachments"
YHR085W,IPI1,-0.000973341,-0.002556886,0.001583545,Involved in Processing ITS2,Essential component of the Rix1 complex (with Rix1p and Ipi3p) that is required for processing of ITS2 sequences from 35S pre-rRNA; Rix1 complex associates with Mdn1p in pre-60S ribosomal particles
YDR236C,FMN1,-0.000951684,-0.001396613,0.000444929,FMN biosynthesis,"Riboflavin kinase, produces riboflavin monophosphate (FMN); FMN is a necessary cofactor for many enzymes; predominantly localizes to the microsomal fraction and also found in the mitochondrial inner membrane"
YDL205C,HEM3,-0.000947716,0.004840645,0.005788361,HEMe biosynthesis,"Porphobilinogen deaminase, catalyzes the conversion of 4-porphobilinogen to hydroxymethylbilane, the third step in heme biosynthesis; localizes to the cytoplasm and nucleus; expression is regulated by Hap2p-Hap3p, but not by levels of heme"
YNL062C,GCD10,-0.000915281,-0.00037295,0.000542331,General Control Derepressed,"Subunit of tRNA (1-methyladenosine) methyltransferase with Gcd14p, required for the modification of the adenine at position 58 in tRNAs, especially tRNAi-Met; first identified as a negative regulator of GCN4 expression"
YPL010W,RET3,-0.000910437,-0.004810329,0.003899892,RETrieval from ER,"Zeta subunit of the coatomer complex (COPI), which coats Golgi-derived transport vesicles; involved in retrograde transport between Golgi and ER"
YLR359W,ADE13,-0.000908538,-0.000368121,0.000540418,ADEnine requiring,"Adenylosuccinate lyase, catalyzes two steps in the 'de novo' purine nucleotide biosynthetic pathway; expression is repressed by adenine and activated by Bas1p and Pho2p; mutations in human ortholog ADSL cause adenylosuccinase deficiency"
YKL112W,ABF1,-0.000896954,-0.000794814,0.00010214,ARS-Binding Factor 1,"DNA binding protein with possible chromatin-reorganizing activity involved in transcriptional activation, gene silencing, and DNA replication and repair"
YHR068W,DYS1,-0.000893606,0.003380745,0.004274351,DeoxyhYpusine Synthase,"Deoxyhypusine synthase, catalyzes formation of deoxyhypusine, the first step in hypusine biosynthesis; triggers posttranslational hypusination of translation elongation factor eIF-5A and regulates its intracellular levels; tetrameric"
YLR026C,SED5,-0.000886794,-0.013196826,0.012310031,Suppressor of Erd2 Deletion,"cis-Golgi t-SNARE syntaxin required for vesicular transport between the ER and the Golgi complex, binds at least 9 SNARE proteins"
YLR129W,DIP2,-0.000863109,0.007268097,0.008131206,DOM34 Interacting Protein,"Nucleolar protein, specifically associated with the U3 snoRNA, part of the large ribonucleoprotein complex known as the small subunit (SSU) processome, required for 18S rRNA biogenesis, part of the active pre-rRNA processing complex"
YER036C,ARB1,-0.000842113,0.003885621,0.004727734,ATP-binding cassette protein involved in Ribosome Biogenesis,"ATPase of the ATP-binding cassette (ABC) family involved in 40S and 60S ribosome biogenesis, has similarity to Gcn20p; shuttles from nucleus to cytoplasm, physically interacts with Tif6p, Lsg1p"
YBR011C,IPP1,-0.000823325,-0.000244999,0.000578326,Inorganic PyroPhosphatase,"Cytoplasmic inorganic pyrophosphatase (PPase), homodimer that catalyzes the rapid exchange of oxygens from Pi with water, highly expressed and essential for viability, active-site residues show identity to those from E. coli PPase"
YPL204W,HRR25,-0.000796818,-0.002028115,0.001231297,0,"Protein kinase involved in regulating diverse events including vesicular trafficking, DNA repair, and chromosome segregation; binds the CTD of RNA pol II; homolog of mammalian casein kinase 1delta (CK1delta)"
YLL018C,DPS1,-0.000767681,-0.007940063,0.007172382,0,"Aspartyl-tRNA synthetase, primarily cytoplasmic; homodimeric enzyme that catalyzes the specific aspartylation of tRNA(Asp); class II aminoacyl tRNA synthetase; binding to its own mRNA may confer autoregulation"
YNL039W,BDP1,-0.000719681,0.004159012,0.004878693,B Double Prime,"Essential subunit of RNA polymerase III transcription factor (TFIIIB), which is involved in transcription of genes encoding tRNAs, 5S rRNA, U6 snRNA, and other small RNAs"
YER023W,PRO3,-0.000693218,0.003313468,0.004006685,PROline requiring,"Delta 1-pyrroline-5-carboxylate reductase, catalyzes the last step in proline biosynthesis"
YGL169W,SUA5,-0.000691751,0.003311063,0.004002814,Suppressor of Upstream AUG,"Single-stranded telomeric DNA-binding protein, required for normal telomere length; null mutant lacks N6-threonylcarbamoyl adenosine (t6A) modification in the anticodon loop of ANN-decoding tRNA; member of conserved YrdC/Sua5 family"
YJR007W,SUI2,-0.000687442,0.007227112,0.007914554,SUppressor of Initiator codon,"Alpha subunit of the translation initiation factor eIF2, involved in the identification of the start codon; phosphorylation of Ser51 is required for regulation of translation by inhibiting the exchange of GDP for GTP"
YDL087C,LUC7,-0.000685606,0.000647394,0.001333,Lethal Unless Cap-binding complex is produced,Essential protein associated with the U1 snRNP complex; splicing factor involved in recognition of 5' splice site; contains two zinc finger motifs; N-terminal zinc finger binds pre-mRNA
YHR188C,GPI16,-0.000674356,0.001454459,0.002128815,GlycosylPhosphatidylInositol anchor biosynthesis,Transmembrane protein subunit of the glycosylphosphatidylinositol transamidase complex that adds GPIs to newly synthesized proteins; human PIG-Tp homolog
YOR370C,MRS6,-0.000665556,-0.004958806,0.00429325,Mitochondrial RNA Splicing,"Rab escort protein, forms a complex with the Ras-like small GTPase Ypt1p that is required for the prenylation of Ypt1p by protein geranylgeranyltransferase type II (Bet2p-Bet4p); sequence similarity to mammalian choroideraemia gene"
YOR075W,UFE1,-0.000664449,-0.001806722,0.001142272,Unknown Function Essential,"t-SNARE required for retrograde vesicular traffic and homotypic ER membrane fusion; forms a complex with the SNAREs Sec22p, Sec20p and Use1p to mediate fusion of Golgi-derived vesicles at the ER"
YDR356W,SPC110,-0.000629757,-0.001193822,0.000564065,Spindle Pole Component,"Inner plaque spindle pole body (SPB) component, ortholog of human kendrin; involved in connecting nuclear microtubules to SPB; interacts with Tub4p-complex and calmodulin; phosphorylated by Mps1p in cell cycle-dependent manner"
YLR438C-A,LSM3,-0.000626334,0.00711948,0.007745813,Like SM,"Lsm (Like Sm) protein; part of heteroheptameric complexes (Lsm2p-7p and either Lsm1p or 8p): cytoplasmic Lsm1p complex involved in mRNA decay; nuclear Lsm8p complex part of U6 snRNP and possibly involved in processing tRNA, snoRNA, and rRNA"
YKL006C-A,SFT1,-0.000606268,0.006311346,0.006917614,Suppressor of Sed5 Ts,"Intra-Golgi v-SNARE, required for transport of proteins between an early and a later Golgi compartment"
YJL156C,SSY5,-0.000600989,-0.001795299,0.00119431,Sulfonylurea Sensitive on YPD,"Serine protease of SPS plasma membrane amino acid sensor system (Ssy1p-Ptr3p-Ssy5p); contains an inhibitory domain that dissociates in response to extracellular amino acids, freeing a catalytic domain to activate transcription factor Stp1p"
YMR298W,LIP1,-0.000589928,0.000669081,0.001259009,Lag1p/Lac1p Interacting Protein,"Ceramide synthase subunit; single-span ER membrane protein associated with Lag1p and Lac1p and required for ceramide synthase activity, null mutant grows extremely slowly and is defective in ceramide synthesis"
YPL153C,RAD53,-0.000555286,-0.00051601,3.93E-05,RADiation sensitive,"Protein kinase, required for cell-cycle arrest in response to DNA damage; activated by trans autophosphorylation when interacting with hyperphosphorylated Rad9p; also interacts with ARS1 and plays a role in initiation of DNA replication"
YDL045C,FAD1,-0.000553075,0.002705174,0.00325825,FAD synthetase,"Flavin adenine dinucleotide (FAD) synthetase, performs the second step in synthesis of FAD from riboflavin"
YGR280C,PXR1,-0.000525947,0.006976088,0.007502034,PinX1-Related gene,"Essential protein involved in rRNA and snoRNA maturation; competes with TLC1 RNA for binding to Est2p, suggesting a role in negative regulation of telomerase; human homolog inhibits telomerase; contains a G-patch RNA interacting domain"
YOR362C,PRE10,-0.000473779,-0.000290325,0.000183454,PRoteinase yscE,Alpha 7 subunit of the 20S proteasome
YIL109C,SEC24,-0.000466901,0.00240354,0.002870441,SECretory,"Component of the Sec23p-Sec24p heterodimer of the COPII vesicle coat, required for cargo selection during vesicle formation in ER to Golgi transport; homologous to Sfb2p and Sfb3p"
YMR049C,ERB1,-0.000436209,0.002324355,0.002760564,0,"Constituent of 66S pre-ribosomal particles, forms a complex with Nop7p and Ytm1p that is required for maturation of the large ribosomal subunit; required for maturation of the 25S and 5.8S ribosomal RNAs; homologous to mammalian Bop1"
YBL030C,PET9,-0.000420615,0.012612471,0.013033086,PETite colonies,"Major ADP/ATP carrier of the mitochondrial inner membrane, exchanges cytosolic ADP for mitochondrially synthesized ATP; also imports heme and ATP; phosphorylated; required for viability in many lab strains that carry a sal1 mutation"
YLL036C,PRP19,-0.000390813,-0.007004926,0.006614113,Pre-RNA Processing,"Splicing factor associated with the spliceosome; contains a U-box, a motif found in a class of ubiquitin ligases, and a WD40 domain"
YNL260C,LTO1,-0.000386408,0.000807604,0.001194011,#N/A,#N/A
YNL232W,CSL4,-0.000342721,-8.43E-05,0.000258403,Cep1 Synthetic Lethal,Exosome non-catalytic core component; involved in 3'-5' RNA processing and degradation in both the nucleus and the cytoplasm; predicted to contain an S1 RNA binding domain; has similarity to human hCsl4p (EXOSC1)
YIR022W,SEC11,-0.000341479,-0.007340074,0.006998595,SECretory,"18kDa catalytic subunit of the Signal Peptidase Complex (SPC; Spc1p, Spc2p, Spc3p, and Sec11p) which cleaves the signal sequence of proteins targeted to the endoplasmic reticulum"
YBL020W,RFT1,-0.000329236,0.005577842,0.005907078,Requiring Fifty-Three,Essential integral membrane protein that is required for translocation of Man5GlcNac2-PP-Dol from the cytoplasmic side to the lumenal side of the ER membrane but is not the flippase; mutation is suppressed by expression of human p53 protein
YER038C,KRE29,-0.000303069,0.002446007,0.002749076,Killer toxin REsistant,Subunit of the SMC5-SMC6 complex; this complex is involved in removal of X-shaped DNA structures that arise between sister chromatids during DNA replication and repair; heterozygous mutant shows haploinsufficiency in K1 killer toxin resistance
YOR206W,NOC2,-0.000300504,0.001985415,0.002285919,NucleOlar Complex associated,"Protein that forms a nucleolar complex with Mak21p that binds to 90S and 66S pre-ribosomes, as well as a nuclear complex with Noc3p that binds to 66S pre-ribosomes; both complexes mediate intranuclear transport of ribosomal precursors"
YPR108W,RPN7,-0.00029744,0.00228536,0.002582799,Regulatory Particle Non-ATPase,"Essential, non-ATPase regulatory subunit of the 26S proteasome, similar to another S. cerevisiae regulatory subunit, Rpn5p, as well as to mammalian proteasome subunits"
YKR063C,LAS1,-0.000297385,-0.004162936,0.00386555,Lethal in the Absence of SSD1-v,Protein required for pre-rRNA processing at both ends of ITS2; may coordinate the action of the Rat1p-Rai1p exoRNAse; required for the G1/S transition of the cell cycle; human ortholog is Las1L; mutants require the SSD1-v allele for viability
YDL217C,TIM22,-0.000291393,0.004909247,0.00520064,Translocase of the Inner Mitochondrial membrane,Essential core component of the mitochondrial TIM22 complex involved in insertion of polytopic proteins into the inner membrane; forms the channel through which proteins are imported
YMR220W,ERG8,-0.000274182,0.003693916,0.003968098,ERGosterol biosynthesis,"Phosphomevalonate kinase, an essential cytosolic enzyme that acts in the biosynthesis of isoprenoids and sterols, including ergosterol, from mevalonate"
YGR175C,ERG1,-0.00026776,-0.010031968,0.009764208,ERGosterol biosynthesis,"Squalene epoxidase, catalyzes the epoxidation of squalene to 2,3-oxidosqualene; plays an essential role in the ergosterol-biosynthesis pathway and is the specific target of the antifungal drug terbinafine"
YBL074C,AAR2,-0.000204129,0.005688418,0.005892547,A1-Alpha2 Repression,"Component of the U5 snRNP, required for splicing of U3 precursors; originally described as a splicing factor specifically required for splicing pre-mRNA of the MATa1 cistron"
YBR234C,ARC40,-0.000183222,0.004349188,0.00453241,ARp2/3 Complex subunit,"Subunit of the ARP2/3 complex, which is required for the motility and integrity of cortical actin patches"
YLR066W,SPC3,-0.000157201,0.002829844,0.002987046,Signal Peptidase Complex,"Subunit of signal peptidase complex (Spc1p, Spc2p, Spc3p, Sec11p), which catalyzes cleavage of N-terminal signal sequences of proteins targeted to the secretory pathway; homologous to mammalian SPC22/23"
YNL172W,APC1,-0.000144884,-0.007441875,0.007296991,Anaphase Promoting Complex subunit,"Largest subunit of the Anaphase-Promoting Complex/Cyclosome (APC/C), which is a ubiquitin-protein ligase required for degradation of anaphase inhibitors, including mitotic cyclins, during the metaphase/anaphase transition; component of the platform domain of the APC/C, based on structural analysis"
YKL186C,MTR2,-0.000128756,0.0039802,0.004108956,Mrna TRansport,"mRNA transport regulator, essential nuclear protein; Mex67p and Mtr2p form a mRNA export complex which binds to RNA"
YML125C,PGA3,-0.000113706,-0.002393913,0.002280207,Processing of Gas1p and ALP,"Putative cytochrome b5 reductase, localized to the plasma membrane; may be involved in regulation of lifespan; required for maturation of Gas1p and Pho8p, proposed to be involved in protein trafficking"
YNL161W,CBK1,-9.71E-05,0.004843007,0.004940151,Cell wall Biosynthesis Kinase,"Serine/threonine protein kinase of the the RAM signaling network; Ndr/LATS family member; binds regulatory subunit Mob2p; involved in regulation of cellular morphogenesis, polarized growth, and septum destruction; phosphorylation by Cbk1p regulates localization and activity of Ace2p transcription factor and Ssd1p translational repressor; Cbk1p activity is regulated by both phosphorylation and specific localization"
YKR062W,TFA2,-9.27E-05,-0.002544863,0.002452149,"Transcription Factor a, subunit 2","TFIIE small subunit, involved in RNA polymerase II transcription initiation"
YIR012W,SQT1,-7.58E-05,0.005522011,0.005597799,0,Essential protein involved in a late step of 60S ribosomal subunit assembly or modification; contains multiple WD repeats; interacts with Qsr1p in a two-hybrid assay
YOR272W,YTM1,-7.07E-05,0.000667729,0.000738422,0,"Constituent of 66S pre-ribosomal particles, forms a complex with Nop7p and Erb1p that is required for maturation of the large ribosomal subunit; has seven C-terminal WD repeats"
YOR250C,CLP1,-4.77E-05,0.006383944,0.006431626,CLeavage/Polyadenylation factor Ia subunit,"Component of the cleavage and polyadenylation factor I (CF I); CF 1, composed of the CF 1A complex (Rna14p, Rna15p, Clp1p, Pcf11p) and Hrp1, is involved in cleavage and polyadenylation of mRNA 3' ends; involved in both the endonucleolyitc cleavage and polyadenylation steps of mRNA 3'-end maturation"
YLL011W,SOF1,-3.77E-05,-0.010032862,0.009995131,Suppressor Of Fibrillarin,Essential protein required for biogenesis of 40S (small) ribosomal subunit; has similarity to the beta subunit of trimeric G-proteins and the splicing factor Prp4p
YHR197W,RIX1,-2.31E-05,-0.000288893,0.000265784,RIbosome eXport,"Essential component of the Rix1 complex (Rix1p, Ipi1p, Ipi3p) that is required for processing of ITS2 sequences from 35S pre-rRNA; Rix1 complex associates with Mdn1p in pre-60S ribosomal particles"
YDL207W,GLE1,0,0.005595273,0.005595273,GLFG (glycine-leucine-phenylalanine-glycine) LEthal,"Cytoplasmic nucleoporin required for polyadenylated RNA export; not essential for protein import; contains a nuclear export signal; when bound to inositol hexakisphosphate (IP6), functions as an activator for the Dbp5p ATPase activity at the nuclear pore complex during mRNA export"
YDR328C,SKP1,0,0.004874945,0.004874945,Suppressor of Kinetochore Protein mutant,"Evolutionarily conserved kinetochore protein that is part of multiple protein complexes, including the SCF ubiquitin ligase complex, the CBF3 complex that binds centromeric DNA, and the RAVE complex that regulates assembly of the V-ATPase"
YGL120C,PRP43,0,0.001490284,0.001490284,Pre-mRNA Processing,"RNA helicase in the DEAH-box family, functions in both RNA polymerase I and polymerase II transcript metabolism, involved in release of the lariat-intron from the spliceosome"
YPL210C,SRP72,0,-0.000197377,0.000197377,Signal Recognition Particle,Core component of the signal recognition particle (SRP) ribonucleoprotein (RNP) complex that functions in targeting nascent secretory proteins to the endoplasmic reticulum (ER) membrane
YMR128W,ECM16,0,-0.003113658,0.003113658,ExtraCellular Mutant,"Essential DEAH-box ATP-dependent RNA helicase specific to the U3 snoRNP, predominantly nucleolar in distribution, required for 18S rRNA synthesis"
YBR004C,GPI18,0,-0.003266616,0.003266616,GlycosylPhosphatidylInositol,"Functional ortholog of human PIG-V, which is a mannosyltransferase that transfers the second mannose in glycosylphosphatidylinositol biosynthesis; the authentic, non-tagged protein was localized to mitochondria"
YBR091C,TIM12,1.61E-05,0.005741487,0.005725389,Translocase of the Inner Membrane,"Essential protein of the inner mitochondrial membrane, peripherally localized; component of the TIM22 complex, which is a twin-pore translocase that mediates insertion of numerous multispanning inner membrane proteins"
YGR179C,OKP1,2.13E-05,-0.006233239,0.00625456,Outer Kinetochore Protein,"Outer kinetochore protein, required for accurate mitotic chromosome segregation; component of the kinetochore sub-complex COMA (Ctf19p, Okp1p, Mcm21p, Ame1p) that functions as a platform for kinetochore assembly"
YPR187W,RPO26,2.31E-05,-0.000490933,0.000514042,RNA POlymerase,"RNA polymerase subunit ABC23, common to RNA polymerases I, II, and III; part of central core; similar to bacterial omega subunit"
YJL041W,NSP1,2.44E-05,-0.007436245,0.007460619,NucleoSkeletal-like Protein,"FG-nucleoporin component of central core of the nuclear pore complex (NPC); also part of the NPC nuclear basket; contributes directly to nucleocytoplasmic transport and maintenance of the NPC permeability barrier; found in stable complex with Nup82p, Gle2p and two other FG-nucleoporins (Nup159p and Nup116p); also found in stable complex with Nic96p and two other FG-nucleoproteins (Nup49p and Nup57p)"
YML114C,TAF8,3.77E-05,-0.00415462,0.004192352,TATA binding protein-Associated Factor,"TFIID subunit (65 kDa), involved in RNA polymerase II transcription initiation"
YPL175W,SPT14,4.77E-05,-0.00192959,0.001977271,SuPpressor of Ty,"UDP-GlcNAc-binding and catalytic subunit of the enzyme that mediates the first step in glycosylphosphatidylinositol (GPI) biosynthesis, mutations cause defects in transcription and in biogenesis of cell wall proteins"
YOR310C,NOP58,5.52E-05,-0.002349558,0.002404757,NucleOlar Protein of 58 kDa,"Protein involved in pre-rRNA processing, 18S rRNA synthesis, and snoRNA synthesis; component of the small subunit processome complex, which is required for processing of pre-18S rRNA"
YJL035C,TAD2,7.58E-05,-0.011595588,0.011671376,tRNA-specific Adenosine Deaminase,"Subunit of tRNA-specific adenosine-34 deaminase, forms a heterodimer with Tad3p that converts adenosine to inosine at the wobble position of several tRNAs"
YNL263C,YIF1,8.10E-05,0.001994891,0.001913877,YIP1-Interacting Factor,"Integral membrane protein required for the fusion of ER-derived COPII transport vesicles with the Golgi; interacts with Yip1p and Yos1p; localizes to the Golgi, the ER, and COPII vesicles; homolog of human YIPF3"
YJL090C,DPB11,9.27E-05,0.000986583,0.000893869,DNA Polymerase B (II),Replication initiation protein that loads DNA pol epsilon onto pre-replication complexes at origins; checkpoint sensor recruited to stalled replication forks by the checkpoint clamp complex where it activates Mec1p; ortholog of human TopBP1
YDL092W,SRP14,0.000140759,0.00077545,0.000634691,Signal Recognition Particle,"Signal recognition particle (SRP) subunit, interacts with the RNA component of SRP to form the Alu domain, which is the region of SRP responsible for arrest of nascent chain elongation during membrane targeting; homolog of mammalian SRP14"
YDR361C,BCP1,0.000142415,0.006576589,0.006434174,0,"Essential protein involved in nuclear export of Mss4p, which is a lipid kinase that generates phosphatidylinositol 4,5-biphosphate and plays a role in actin cytoskeleton organization and vesicular transport"
YBR243C,ALG7,0.000156143,-0.010699519,0.010855662,Asparagine-Linked Glycosylation,"UDP-N-acetyl-glucosamine-1-P transferase, transfers Glc-Nac-P from UDP-GlcNac to Dol-P in the ER in the first step of the dolichol pathway of protein asparagine-linked glycosylation; inhibited by tunicamycin"
YKL154W,SRP102,0.00017347,0.003709006,0.003535536,Signal Recognition Particle,"Signal recognition particle (SRP) receptor beta subunit; involved in SRP-dependent protein targeting; anchors the alpha subunit, Srp101p to the ER membrane"
YJR093C,FIP1,0.000177485,-0.006478658,0.006656144,Factor Interacting with Poly(A) polymerase,"Subunit of cleavage polyadenylation factor (CPF), interacts directly with poly(A) polymerase (Pap1p) to regulate its activity; bridging factor that links Pap1p and the CPF complex via Yth1p"
YPL169C,MEX67,0.00021523,0.000690443,0.000475213,Messenger RNA EXport factor of 67 kDa,"Poly(A)RNA binding protein involved in nuclear mRNA export, component of the nuclear pore; ortholog of human TAP"
YPL094C,SEC62,0.000219257,0.000323131,0.000103873,SECretory,"Essential subunit of Sec63 complex (Sec63p, Sec62p, Sec66p and Sec72p); with Sec61 complex, Kar2p/BiP and Lhs1p forms a channel competent for SRP-dependent and post-translational SRP-independent protein targeting and import into the ER"
YIL021W,RPB3,0.0002323,,0.0002323,RNA Polymerase B,"RNA polymerase II third largest subunit B44, part of central core; similar to prokaryotic alpha subunit"
YEL026W,SNU13,0.000235812,0.003331095,0.003095283,Small NUclear ribonucleoprotein associated,"RNA binding protein, part of U3 snoRNP involved in rRNA processing, part of U4/U6-U5 tri-snRNP involved in mRNA splicing, similar to human 15.5K protein"
YFR003C,YPI1,0.000266013,0.000609088,0.000343076,Yeast Phosphatase Inhibitor,"Regulatory subunit of the type I protein phosphatase (PP1) Glc7p; Glc7p participates in the regulation of a variety of metabolic processes including mitosis and glycogen metabolism; in vitro evidence suggests Ypi1p is an inhibitor of Glc7p while in vivo evidence suggests it is an activator; overproduction causes decreased cellular content of glycogen; partial depletion causes lithium sensitivity, while overproduction confers lithium-tolerance"
YJR017C,ESS1,0.000275145,-0.00082833,0.001103475,ESSential,Peptidylprolyl-cis/trans-isomerase (PPIase); specific for phosphorylated serine and threonine residues N-terminal to proline; regulates phosphorylation of the RNAP II large subunit (Rpo21p) C-terminal domain (CTD); associates with phospho-Ser5 form of RNAP II in vivo; regulates phosphorylation of Ser7 within CTD; present along entire coding length of genes; represses initiation of CUTs; required for efficient termination of mRNA transcription and trimethylation of histone H3
YPL083C,SEN54,0.000278438,-0.000323131,0.000601568,Splicing ENdonuclease,"Subunit of the tRNA splicing endonuclease, which is composed of Sen2p, Sen15p, Sen34p, and Sen54p"
