ORF,GENE,s coeff nominal,s coeff nacl,DIFF,Name,Function
YDR299W,BFR2,0.003569861,-0.005526589,0.00909645,BreFeldin A Resistance,Essential protein that is a component of 90S preribosomes; may be involved in rRNA processing; multicopy suppressor of sensitivity to Brefeldin A; expression is induced during lag phase and also by cold shock
YFR031C,SMC2,0.003579622,0.0012205,0.002359122,Structural Maintenance of Chromosomes,Subunit of the condensin complex; essential SMC chromosomal ATPase family member that forms a complex with Smc4p to form the active ATPase; Smc2p/Smc4p complex binds DNA; required for clustering of tRNA genes at the nucleolus
YAR019C,CDC15,0.003603047,-0.004452167,0.008055215,Cell Division Cycle,Protein kinase of the Mitotic Exit Network that is localized to the spindle pole bodies at late anaphase; promotes mitotic exit by directly switching on the kinase activity of Dbf2p; required for spindle disassembly after meiosis II
YJR065C,ARP3,0.003617557,0.005728369,0.002110812,Actin-Related Protein,"Essential component of the Arp2/3 complex, which is a highly conserved actin nucleation center required for the motility and integrity of actin patches; involved in endocytosis and membrane growth and polarity"
YBL040C,ERD2,0.003658421,0.004087347,0.000428926,Endoplasmic reticulum Retention Defective,"HDEL receptor, an integral membrane protein that binds to the HDEL motif in proteins destined for retention in the endoplasmic reticulum; has a role in maintenance of normal levels of ER-resident proteins"
YKR071C,DRE2,0.00369412,0.018840967,0.015146847,Derepressed for Ribosomal protein S14 Expression,Conserved component of an early step in the cytosolic Fe-S protein assembly (CIA) machinery; contains an Fe-S cluster that receives electrons from NADPH via the action of Tah18p; ortholog of human Ciapin1
YKL042W,SPC42,0.003697415,-0.003434792,0.007132207,Spindle Pole Component,"Central plaque component of spindle pole body (SPB); involved in SPB duplication, may facilitate attachment of the SPB to the nuclear membrane"
YMR240C,CUS1,0.003697645,0.013293759,0.009596114,Cold sensitive U2 snRNA Suppressor,"Protein required for assembly of U2 snRNP into the spliceosome, forms a complex with Hsh49p and Hsh155p"
YDR353W,TRR1,0.003716059,0.006972639,0.00325658,ThioRedoxin Reductase,"Cytoplasmic thioredoxin reductase, key regulatory enzyme that determines the redox state of the thioredoxin system, which acts as a disulfide reductase system and protects cells against both oxidative and reductive stress"
YML127W,RSC9,0.003753036,0.038892439,0.035139403,Remodel the Structure of Chromatin,Component of the RSC chromatin remodeling complex; DNA-binding protein involved in the synthesis of rRNA and in transcriptional repression and activation of genes regulated by the Target of Rapamycin (TOR) pathway
YOR249C,APC5,0.003773425,0.00532502,0.001551595,Anaphase Promoting Complex,"Subunit of the Anaphase-Promoting Complex/Cyclosome (APC/C), which is a ubiquitin-protein ligase required for degradation of anaphase inhibitors, including mitotic cyclins, during the metaphase/anaphase transition; component of the platform domain of the APC/C, based on structural analysis"
YBR155W,CNS1,0.003800504,-0.001248054,0.005048559,CyclophiliN Seven suppressor,"TPR-containing co-chaperone; binds both Hsp82p (Hsp90) and Ssa1p (Hsp70) and stimulates the ATPase activity of SSA1, ts mutants reduce Hsp82p function while over expression suppresses the phenotypes of an HSP82 ts allele and a cpr7 deletion"
YGL123W,RPS2,0.003831459,-0.000152677,0.003984136,Ribosomal Protein of the Small subunit,"Protein component of the small (40S) subunit, essential for control of translational accuracy; phosphorylation by C-terminal domain kinase I (CTDK-I) enhances translational accuracy; methylated on one or more arginine residues by Hmt1p"
YJR013W,GPI14,0.003832274,0.001550414,0.00228186,GlycosylPhosphatidylInositol anchor biosynthesis,"Glycosylphosphatidylinositol-alpha 1,4 mannosyltransferase I, involved in GPI anchor biosynthesis, requires Pbn1p for function; homolog of mammalian PIG-M"
YOR116C,RPO31,0.003845319,-0.021513067,0.025358386,RNA POlymerase,"RNA polymerase III largest subunit C160, part of core enzyme; similar to bacterial beta-prime subunit and to RPA190 and RPO21"
YDR527W,RBA50,0.003881891,0.009802793,0.005920902,RNA polymerase II (B) Associated protein,"Protein involved in transcription; interacts with RNA polymerase II subunits Rpb2p, Rpb3, and Rpb11p; has similarity to human RPAP1"
YDR499W,LCD1,0.003882041,0.001956857,0.001925184,"Lethal, Checkpoint-defective, DNA damage sensitive",Essential protein required for the DNA integrity checkpoint pathways; interacts physically with Mec1p; putative homolog of S. pombe Rad26 and human ATRIP
YMR146C,TIF34,0.003884655,-0.001479688,0.005364343,Translation Initiation Factor,"eIF3i subunit of the core complex of translation initiation factor 3 (eIF3), which is essential for translation; stimulates rate of ribosomal scanning during translation reinitiation"
YKL189W,HYM1,0.003902188,9.45E-05,0.003807672,0,"Component of the RAM signaling network that is involved in regulation of Ace2p activity and cellular morphogenesis, interacts with Kic1p and Sog2p, localizes to sites of polarized growth during budding and during the mating response"
YJR042W,NUP85,0.003932938,0.005491369,0.001558431,NUclear Pore,"Subunit of the Nup84p subcomplex of the nuclear pore complex (NPC); contributes to nucleocytoplasmic transport and NPC biogenesis and is involved in establishment of a normal nucleocytoplasmic concentration gradient of the GTPase Gsp1p; also plays roles in several processes that may require localization of genes or chromosomes at the nuclear periphery, including double-strand break repair, transcription and chromatin silencing; homologous to human NUP85 aka NUP75"
YDR240C,SNU56,0.00394136,0.003213262,0.000728098,Small NUclear ribonucleoprotein associated,"Component of U1 snRNP required for mRNA splicing via spliceosome; yeast specific, no metazoan counterpart; interacts with mRNA in commitment complex"
YDL030W,PRP9,0.003960962,0.006502123,0.00254116,Pre-mRNA Processing,"Subunit of the SF3a splicing factor complex, required for spliceosome assembly; acts after the formation of the U1 snRNP-pre-mRNA complex"
YDR021W,FAL1,0.003992035,-0.005004149,0.008996185,eukaryotic translation initiation factor Four A Like,"Nucleolar protein required for maturation of 18S rRNA, member of the eIF4A subfamily of DEAD-box ATP-dependent RNA helicases"
YLR088W,GAA1,0.004019794,0.004424165,0.000404371,GPI Anchor Attachment,"Subunit of the GPI (glycosylphosphatidylinositol):protein transamidase complex, removes the GPI-anchoring signal and attaches GPI to proteins in the ER"
YDR292C,SRP101,0.004031923,-0.00795434,0.011986263,Signal Recognition Particle,"Signal recognition particle (SRP) receptor alpha subunit; contain GTPase domains; involved in SRP-dependent protein targeting; interacts with the beta subunit, Srp102p"
YNL240C,NAR1,0.004085126,0.001091985,0.002993141,Nuclear Architecture Related,"Component of the cytosolic iron-sulfur (FeS) protein assembly machinery, required for maturation of cytosolic and nuclear FeS proteins and for normal resistance to oxidative stress; homologous to human Narf"
YLR314C,CDC3,0.004090702,0.000773376,0.003317326,Cell Division Cycle,Component of the septin ring that is required for cytokinesis; septins are GTP-binding proteins that assemble with other septins into rod-like complexes that can associate with other rods to form filament polymers; septin rings at the mother-bud neck act as scaffolds for recruiting factors needed for cell division and as barriers to prevent diffusion of specific proteins between mother and daughter cells
YDL017W,CDC7,0.004163541,0.003023191,0.00114035,Cell Division Cycle,"DDK (Dbf4-dependent kinase) catalytic subunit required for origin firing and replication fork progression in mitotic S phase through phosphorylation of Mcm2-7p complexes and Cdc45p; kinase activity correlates with cyclical DBF4 expression; required for pre-meiotic DNA replication, meiotic DSB formation, recruitment of the monopolin complex to kinetochores during meiosis I and as a gene-specific regulator of the meiosis-specific transcription factor Ndt80p"
YDR472W,TRS31,0.004172748,0.010455295,0.006282547,TRapp Subunit,One of 10 subunits of the transport protein particle (TRAPP) complex of the cis-Golgi which mediates vesicle docking and fusion; involved in endoplasmic reticulum (ER) to Golgi membrane traffic
YOR148C,SPP2,0.004191425,-0.001032502,0.005223926,Suppressor of PrP,"Essential protein that promotes the first step of splicing and is required for the final stages of spliceosome maturation; interacts with Prp2p, which may release Spp2p from the spliceosome following the first cleavage reaction"
YKL145W,RPT1,0.004197301,0.002766222,0.001431079,"Regulatory Particle Triple-A protein, or Regulatory Particle Triphosphatase",One of six ATPases of the 19S regulatory particle of the 26S proteasome involved in the degradation of ubiquitinated substrates; required for optimal CDC20 transcription; interacts with Rpn12p and Ubr1p; mutant has aneuploidy tolerance
YCR054C,CTR86,0.004204048,-0.003699197,0.007903244,Copper TRansport protein,"Essential protein of unknown function; with orthologs in Ashbya gossypii and Candida albicans; similar to human ATXN10, mutations in which cause spinocerebellar ataxia type 10; codon usage corresponds to that observed for yeast genes expressed at low levels"
YDL108W,KIN28,0.004231757,-0.000840657,0.005072414,protein KINase,"Serine/threonine protein kinase, subunit of the transcription factor TFIIH; involved in transcription initiation at RNA polymerase II promoters"
YLR033W,RSC58,0.004240804,0.001834888,0.002405915,Remodel the Structure of Chromatin,"Component of the RSC chromatin remodeling complex; RSC functions in transcriptional regulation and elongation, chromosome stability, and establishing sister chromatid cohesion; involved in telomere maintenance"
YNR017W,TIM23,0.004336679,0.010029448,0.005692768,Translocase of the Inner Mitochondrial membrane,"Essential component of the Translocase of the Inner Mitochondrial membrane (TIM23 complex); involved in protein import into mitochondrial matrix and inner membrane; with Tim17p, contributes to architecture and function of the import channel"
YPR186C,PZF1,0.004339276,0.007921842,0.003582566,Putative Zinc Finger,Transcription factor IIIA (TFIIIA); essential DNA binding protein required for transcription of 5S rRNA by RNA polymerase III; not involved in transcription of other RNAP III genes; nine conserved zinc fingers; may also bind 5S rRNA
YGL091C,NBP35,0.004426999,0.002344548,0.00208245,Nucleotide Binding Protein,Essential iron-sulfur cluster binding protein localized in the cytoplasm; forms a complex with Cfd1p that is involved in iron-sulfur protein assembly in the cytosol; similar to P-loop NTPases
YJL002C,OST1,0.004463766,0.000462626,0.004001139,OligoSaccharylTransferase,"Alpha subunit of the oligosaccharyltransferase complex of the ER lumen, which catalyzes asparagine-linked glycosylation of newly synthesized proteins"
YLR086W,SMC4,0.004467883,-0.001943328,0.006411211,Structural Maintenance of Chromosomes,Subunit of the condensin complex; reorganizes chromosomes during cell division; forms a complex with Smc2p that has ATP-hydrolyzing and DNA-binding activity; required for tRNA gene clustering at the nucleolus; potential Cdc28p substrate
YCR052W,RSC6,0.004484967,0.0058857,0.001400734,Remodel the Structure of Chromatin,Component of the RSC chromatin remodeling complex; essential for mitotic growth; homolog of SWI/SNF subunit Swp73p
YJL050W,MTR4,0.004491586,-0.033994591,0.038486177,Mrna TRansport,"ATP-dependent 3'-5' RNA helicase of the DExD/H family; involved in nuclear RNA processing and degradation both as a component of the TRAMP complex and in TRAMP-independent processes; contains an arch domain, composed of two coiled-coil arms/stalks and a globular fist/KOW domain, that has RNA binding activity and is required for 5.8S rRNA processing"
YBR121C,GRS1,0.00454367,0.005247306,0.000703635,Glycyl-tRNA Synthase,Cytoplasmic and mitochondrial glycyl-tRNA synthase that ligates glycine to the cognate anticodon bearing tRNA; transcription termination factor that may interact with the 3'-end of pre-mRNA to promote 3'-end formation
YLR316C,TAD3,0.00464163,0.004399183,0.000242447,tRNA-specific Adenosine Deaminase,"Subunit of tRNA-specific adenosine-34 deaminase, forms a heterodimer with Tad2p that converts adenosine to inosine at the wobble position of several tRNAs"
YGR120C,COG2,0.004672774,-0.006302655,0.010975429,Conserved Oligomeric Golgi complex,"Essential component of the conserved oligomeric Golgi complex (Cog1p through Cog8p), a cytosolic tethering complex that functions in protein trafficking to mediate fusion of transport vesicles to Golgi compartments"
YEL058W,PCM1,0.004714306,0.001837961,0.002876345,PhosphoaCetylglucosamine Mutase,"Essential N-acetylglucosamine-phosphate mutase; converts GlcNAc-6-P to GlcNAc-1-P, which is a precursor for the biosynthesis of chitin and for the formation of N-glycosylated mannoproteins and glycosylphosphatidylinositol anchors"
YCR012W,PGK1,0.004716644,0.006206761,0.001490118,3-PhosphoGlycerate Kinase,"3-phosphoglycerate kinase, catalyzes transfer of high-energy phosphoryl groups from the acyl phosphate of 1,3-bisphosphoglycerate to ADP to produce ATP; key enzyme in glycolysis and gluconeogenesis"
YML093W,UTP14,0.004744868,-0.00026417,0.005009037,U Three Protein,Subunit of U3-containing Small Subunit (SSU) processome complex involved in production of 18S rRNA and assembly of small ribosomal subunit
YOR149C,SMP3,0.004763815,0.007641942,0.002878127,0,"Alpha 1,2-mannosyltransferase involved in glycosyl phosphatidyl inositol (GPI) biosynthesis; required for addition of the fourth, side branching mannose to the GPI core structure"
YDR177W,UBC1,0.004814795,0.013910467,0.009095671,UBiquitin-Conjugating,Ubiquitin-conjugating enzyme that mediates selective degradation of short-lived and abnormal proteins; plays a role in vesicle biogenesis and ER-associated protein degradation (ERAD); component of the cellular stress response
YGL145W,TIP20,0.004876378,0.012956298,0.00807992,SEC20 (Twenty) Interacting Protein,Peripheral membrane protein required for fusion of COPI vesicles with the ER; prohibits back-fusion of COPII vesicles with the ER; forms a tethering complex with Sec39p and Dsl1p that interacts with ER SNAREs Sec20p and Use1p
YLR010C,TEN1,0.004891229,0.010104934,0.005213705,TElomeric pathways with STn1,Protein that regulates telomeric length; protects telomeric ends in a complex with Cdc13p and Stn1p
YDR172W,SUP35,0.004900566,-0.001799445,0.006700011,SUPpressor,"Translation termination factor eRF3, has a role in mRNA deadenylation and decay; altered protein conformation creates the [PSI(+)] prion that alters translational fidelity and results in a nonsense suppressor phenotype"
YDR164C,SEC1,0.004914546,-0.001732886,0.006647432,SECretory,Sm-like protein involved in docking and fusion of exocytic vesicles; binds to assembled SNARE complexes at the membrane and stimulates membrane fusion; localization to sites of secretion (bud neck and bud tip) is dependent on SNARE function
YKL193C,SDS22,0.004928941,-0.00555491,0.010483851,homolog of S. pombe SDS22,Regulatory subunit of the type 1 protein phosphatase (PP1) Glc7p; whether it functions as a positive or negative regulator of Glc7p is controversial; involved in the regulation of Glc7p nuclear localization and function
YJR016C,ILV3,0.004936981,0.008576347,0.003639365,IsoLeucine-plus-Valine requiring,"Dihydroxyacid dehydratase, catalyzes third step in the common pathway leading to biosynthesis of branched-chain amino acids"
YPL122C,TFB2,0.004942327,0.00939565,0.004453323,Transcription initiation Factor IIB,"Subunit of TFIIH and nucleotide excision repair factor 3 complexes, involved in transcription initiation, required for nucleotide excision repair, similar to 52 kDa subunit of human TFIIH"
YDL060W,TSR1,0.004968186,-0.009454174,0.01442236,Twenty S rRNA accumulation,Protein required for processing of 20S pre-rRNA in the cytoplasm; associates with pre-40S ribosomal particles; inhibits the premature association of 60S subunits with assembling 40S subunits in the cytoplasm; similar to Bms1p
YFL002C,SPB4,0.004968907,-0.004621197,0.009590103,Suppressor of PAB1,"Putative ATP-dependent RNA helicase, nucleolar protein required for synthesis of 60S ribosomal subunits at a late step in the pathway; sediments with 66S pre-ribosomes in sucrose gradients"
YNL163C,RIA1,0.004983278,0.000791056,0.004192222,RIbosome Assembly,"Cytoplasmic GTPase involved in ribosomal biogenesis; with Sdo1p, promotes release of Tif6p from 60S ribosomal subunits in the cytoplasm so that they can assemble with 40S subunits to generate mature ribosomes"
YGR140W,CBF2,0.005003498,-0.003831443,0.008834941,Centromere-Binding Factor,"Essential kinetochore protein, component of the CBF3 multisubunit complex that binds to the CDEIII region of the centromere; Cbf2p also binds to the CDEII region possibly forming a different multimeric complex, ubiquitinated in vivo"
YFR028C,CDC14,0.005024966,-0.023307255,0.028332221,Cell Division Cycle,"Protein phosphatase required for mitotic exit; located in the nucleolus until liberated by the FEAR and Mitotic Exit Network in anaphase, enabling it to act on key substrates to effect a decrease in CDK/B-cyclin activity and mitotic exit; required for meiosis I spindle disassembly; released from nucleolus upon entry into anaphase I of meiosis, resequestered in metaphase II, then released again upon entry into anaphase II; maintained in nucleolus by Cdc55p in early meiosis"
YCR057C,PWP2,0.00503364,0.001617347,0.003416293,Periodic tryptophan (W) Protein,"Conserved 90S pre-ribosomal component essential for proper endonucleolytic cleavage of the 35 S rRNA precursor at A0, A1, and A2 sites; contains eight WD-repeats; PWP2 deletion leads to defects in cell cycle and bud morphogenesis"
YFR004W,RPN11,0.005069937,0.0277925,0.022722564,Regulatory Particle Non-ATPase,"Metalloprotease subunit of the 19S regulatory particle of the 26S proteasome lid; couples the deubiquitination and degradation of proteasome substrates; involved, independent of catalytic activity, in fission of mitochondria and peroxisomes"
YJR064W,CCT5,0.005099344,0.004137783,0.00096156,Chaperonin Containing TCP-1,"Subunit of the cytosolic chaperonin Cct ring complex, related to Tcp1p, required for the assembly of actin and tubulins in vivo"
YER125W,RSP5,0.005106864,0.010872581,0.005765718,Reverses Spt- Phenotype,"E3 ubiquitin ligase of the NEDD4 family; involved in regulating many cellular processes including MVB sorting, heat shock response, transcription, endocytosis, and ribosome stability; human homolog is involved in Liddle syndrome; mutant tolerates aneuploidy; ubiquitylates Sec23p"
YDR464W,SPP41,0.005108692,-0.011730787,0.016839479,Suppressor of PrP4,Protein involved in negative regulation of expression of spliceosome components PRP4 and PRP3
YDL235C,YPD1,0.00513965,0.011312606,0.006172957,tyrosine (Y) Phosphatase Dependent,"Phosphorelay intermediate protein, phosphorylated by the plasma membrane sensor Sln1p in response to osmotic stress and then in turn phosphorylates the response regulators Ssk1p in the cytosol and Skn7p in the nucleus"
YNL258C,DSL1,0.005177183,0.000520233,0.004656949,Dependence on SLy1-20,Peripheral membrane protein needed for Golgi-to-ER retrograde traffic; forms a complex with Sec39p and Tip20p that interacts with ER SNAREs Sec20p and Use1p; component of the ER target site that interacts with coatomer; interacts with Cin5p; similar to the fly and human ZW10 gene
YMR028W,TAP42,0.005198927,0.002565124,0.002633803,Two A phosphatase Associated Protein,Essential protein involved in the TOR signaling pathway; physically associates with the protein phosphatase 2A and the SIT4 protein phosphatase catalytic subunits
YIL078W,THS1,0.005201916,0.003318612,0.001883303,THreonyl tRNA Synthetase,"Threonyl-tRNA synthetase, essential cytoplasmic protein"
YBR102C,EXO84,0.005230138,-0.009358886,0.014589023,EXOcyst,"Essential protein with dual roles in spliceosome assembly and exocytosis; the exocyst complex (Sec3p, Sec5p, Sec6p, Sec8p, Sec10p, Sec15p, Exo70p, and Exo84p) mediates polarized targeting of secretory vesicles to active sites of exocytosis"
YOR329C,SCD5,0.005255449,-0.007695592,0.012951041,Suppressor of Clathrin Deficiency,Protein required for normal actin organization and endocytosis; targeting subunit for protein phosphatase type 1; undergoes Crm1p-dependent nuclear-cytoplasmic shuttling; multicopy suppressor of clathrin deficiency
YGR116W,SPT6,0.005294256,-0.015354998,0.020649254,SuPpressor of Ty's,"Nucleosome remodeling protein; functions in various aspects of transcription, chromatin maintenance, and RNA processing; required for the maintenance of chromatin structure during transcription in order to inhibit transcription from promoters within the coding region"
YJL167W,ERG20,0.00531449,-0.002914283,0.008228774,ERGosterol biosynthesis,"Farnesyl pyrophosphate synthetase, has both dimethylallyltranstransferase and geranyltranstransferase activities; catalyzes the formation of C15 farnesyl pyrophosphate units for isoprenoid and sterol biosynthesis"
YKL058W,TOA2,0.00531651,0.008592921,0.003276411,0,"TFIIA small subunit; involved in transcriptional activation, acts as antirepressor or as coactivator; homologous to smallest subunit of human and Drosophila TFIIA"
YER147C,SCC4,0.005340734,0.000856742,0.004483993,Sister Chromatid Cohesion,"Subunit of cohesin loading factor (Scc2p-Scc4p), a complex required for the loading of cohesin complexes onto chromosomes; involved in establishing sister chromatid cohesion during double-strand break repair via phosphorylated histone H2AX"
YHR083W,SAM35,0.005368144,0.003301958,0.002066186,Sorting and Assembly Machinery,"Essential component of the sorting and assembly machinery (SAM complex or TOB complex) of the mitochondrial outer membrane, which binds precursors of beta-barrel proteins and facilitates their insertion into the outer membrane"
YLR336C,SGD1,0.005404709,0.001779168,0.003625541,Suppressor of Glycerol Defect,"Essential nuclear protein, required for biogenesis of the small ribosomal subunit; has a possible role in the osmoregulatory glycerol response; putative homolog of human NOM1 which is implicated in acute myeloid leukemia"
YHR042W,NCP1,0.005423711,0.006306884,0.000883172,0,NADP-cytochrome P450 reductase; involved in ergosterol biosynthesis; associated and coordinately regulated with Erg11p
YBR198C,TAF5,0.005424772,-0.001109933,0.006534705,TATA binding protein-Associated Factor,"Subunit (90 kDa) of TFIID and SAGA complexes, involved in RNA polymerase II transcription initiation and in chromatin modification"
YOR056C,NOB1,0.005446019,0.009616627,0.004170608,Nin1 (One) Binding protein,Essential nuclear protein involved in proteasome maturation and synthesis of 40S ribosomal subunits; required for cleavage of the 20S pre-rRNA to generate the mature 18S rRNA
YPL020C,ULP1,0.005462167,-0.003900623,0.00936279,Ubiquitin-Like Protein,Protease that specifically cleaves Smt3p protein conjugates; required for cell cycle progression; associates with nucleoporins and may interact with septin rings during telophase; sequestered to the nucleolus under stress conditions
YOR336W,KRE5,0.005504073,-0.001466237,0.00697031,Killer toxin REsistant,"Protein required for beta-1,6 glucan biosynthesis; mutations result in aberrant morphology and severe growth defects"
YDR473C,PRP3,0.005539103,0.008531306,0.002992202,Pre-mRNA Processing,"Splicing factor, component of the U4/U6-U5 snRNP complex"
YFR051C,RET2,0.005584526,-0.000117145,0.005701671,RETrieval from ER,"Delta subunit of the coatomer complex (COPI), which coats Golgi-derived transport vesicles; involved in retrograde transport between Golgi and ER"
YLR007W,NSE1,0.005670087,-0.004168164,0.009838251,Non-SMC Element,Component of the SMC5-SMC6 complex; this complex plays a key role in the removal of X-shaped DNA structures that arise between sister chromatids during DNA replication and repair
YJL025W,RRN7,0.005701035,-0.002010322,0.007711358,Regulation of RNA polymerase I,"Component of the core factor (CF) rDNA transcription factor complex; CF is required for transcription of 35S rRNA genes by RNA polymerase I and is composed of Rrn6p, Rrn7p, and Rrn11p"
YDR235W,PRP42,0.005823965,-0.002750397,0.008574362,Pre-mRNA Processing,"U1 snRNP protein involved in splicing, required for U1 snRNP biogenesis; contains multiple tetriatricopeptide repeats"
YPL146C,NOP53,0.005833241,0.004807657,0.001025583,NucleOlar Protein,Nucleolar protein; involved in biogenesis of the 60S subunit of the ribosome; interacts with rRNA processing factors Cbf5p and Nop2p; null mutant is viable but growth is severely impaired
YDR498C,SEC20,0.005838277,0.007733025,0.001894748,SECretory,Membrane glycoprotein v-SNARE involved in retrograde transport from the Golgi to the ER; required for N- and O-glycosylation in the Golgi but not in the ER; interacts with the Dsl1p complex through Tip20p
YKR004C,ECM9,0.00585476,0.00675778,0.00090302,ExtraCellular Mutant,Non-essential protein of unknown function
YDL008W,APC11,0.005858796,0.007473657,0.001614862,Anaphase Promoting Complex,"Catalytic core subunit of the Anaphase-Promoting Complex/Cyclosome (APC/C), which is a ubiquitin-protein ligase required for degradation of anaphase inhibitors, including mitotic cyclins, during the metaphase/anaphase transition; contains a RING-H2 domain that is required for activity"
